[
  {
    "citation":{
      "title":"Project Tracking System",
      "date":[
        {
          "date":"2013-03-13",
          "dateType":"creation"
        }
      ],
      "responsibleParty":[
        {
          "contactId":"1",
          "role":"originator"
        },
        {
          "contactId":"2",
          "role":"publisher"
        }
      ]
    },
    "pointOfContact":[
      {
        "contactId":"1",
        "role":"custodian"
      }
    ],
    "abstract":"The Arctic LCC has developed a Project Tracking System(PTS) to assist with the management of projects. The PTS is used to track projects throughout all stages of development, from receipt of proposals through delivery of final products.",
    "status":"onGoing",
    "language":[
      "eng; USA"
    ],
    "resourceNativeFormat":[
      {
        "formatName":"ExtJS",
        "version":"4.0.7"
      },
      {
        "formatName":"PostgreSQL",
        "version":"9.1"
      },
      {
        "formatName":"PHP",
        "version":"5.3"
      }
    ],
    "keyword":[
      {
        "keyword":[
          "Oceans > Ocean temperature > Thermocline",
          "Oceans > Ocean Temperature > Water Temperature",
          "Oceans > Ocean Heat Budget > Heat Flux"
        ],
        "keywordType":"theme",
        "thesaurus":{
          "title":"NASA/Global Change Master Directory (GCMD) Earth Science Keywords.",
          "date":[
            {
              "date":"2013-09-19",
              "dateType":"revision"
            }
          ],
          "onlineResource":[
            {
              "uri":"http://gcmdservices.gsfc.nasa.gov/static/kms/sciencekeywords/sciencekeywords.csv"
            }
          ],
          "edition":"Version 8.0.0.0.0",
          "responsibleParty":[
            {
              "contactId":"1",
              "role":"originator"
            },
            {
              "contactId":"2",
              "role":"owner"
            }
          ],
          "presentationForm":[
            "documentDigital"
          ],
          "identifier":[
            {
              "type":"isbn",
              "identifier":"HB12365.214"
            },
            {
              "type":"issn",
              "identifier":"0ab4-dd983c01"
            }
          ]
        }
      }
    ]
  },
  {
    "citation":{
      "title":"Project Tracking System",
      "date":[
        {
          "date":"2011-11-11",
          "dateType":"publication"
        },
        {
          "date":"2013-03-13T17:30-08:00",
          "dateType":"revision"
        }
      ],
      "edition":"version 1.2.0",
      "responsibleParty":[
        {
          "contactId":"1",
          "role":"originator"
        },
        {
          "contactId":"2",
          "role":"publisher"
        }
      ],
      "presentationForm":[
        "documentDigital"
      ],
      "additionalIdentifier":{
        "doi":"10.1000/182",
        "isbn":"HB12365.214",
        "issn":"0ab4-dd983c01"
      }
    },
    "pointOfContact":[
      {
        "contactId":"1",
        "role":"custodian"
      }
    ],
    "abstract":"The Arctic LCC has developed a Project Tracking System(PTS) to assist with the management of projects. The PTS is used to track projects throughout all stages of development, from receipt of proposals through delivery of final products.",
    "status":"onGoing",
    "language":[
      "eng; USA",
      "spa; Spanish; Castilian"
    ],
    "purpose":"The LAS files can be used to create DEMs and also to extract topographic data in software that does not support raster data. Other surface features can also be extracted with custom applications. LiDAR data has a wide range of uses such as earthquake hazard studies, hydrologic modeling, forestry, coastal engineering, roadway and pipeline engineering, flood plain mapping, wetland studies, geologic studies and a variety of analytical and cartographic projects.",
    "credit":[
      "FEMA",
      "Washington DNR and Lewis County",
      "Puget Sound LiDAR Consortium (PSLC) - The PSLC is supported by the Puget Sound Regional Council, the National Aeronautical and Space Administration (NASA), the United States Geological Survey (USGS) and numerous partners in local, state, and tribal government."
    ],
    "spatialRepresentation":[
      "textTable",
      "grid",
      "tin"
    ],
    "topicCategory":[
      "boundaries",
      "environment",
      "climatologyMeteorologyAtmosphere"
    ],
    "environmentDescription":"Processed datafiles created in a Windows 7 environment, using R x64 2.15.1, Kepler 2.3, pgAdminIII and Postgres 9.1, and ArcInfo 10.2",
    "supplementalInfo":"A footprint of this data set may be viewed in Google Earth at: <ftp://ftp.csc.noaa.gov/pub/crs/beachmap/qa_docs/wa/pslc2012/wa2012_pslc_chehalis_footprint.KMZ> A Lidar Report from the vendor for this data set may be viewed here: <ftp://ftp.csc.noaa.gov/pub/crs/beachmap/qa_docs/wa/pslc2012/wa2012_pslc_chehalis_lidarreport.pdf>",
    "resourceNativeFormat":[
      {
        "formatName":"ExtJS",
        "version":"4.0.7"
      },
      {
        "formatName":"PostgreSQL",
        "version":"9.1"
      },
      {
        "formatName":"PHP",
        "version":"5.3"
      }
    ],
    "resourceMaintenance":[
      {
        "maintenanceFrequency":"fortnightly"
      },
      {
        "maintenanceFrequency":"annually",
        "maintenanceNote":[
          "Updates to data are generally in available November after the season's field data has been validated"
        ]
      },
      {
        "maintenanceNote":[
          "Test of missing frequency code"
        ]
      }
    ],
    "resourceSpecificUsage":[
      {
        "specificUsage":"Developed for land use planning.",
        "userDeterminedLimitation":"Not suitable for use for navigation.",
        "userContactInfo":[
          {
            "contactId":"3",
            "role":"publisher"
          },
          {
            "contactId":"3",
            "role":"author"
          }
        ]
      },
      {
        "specificUsage":"Bathymetry datasets developed for modeling physical oceanographic conditions in the Barrow Straight.",
        "userContactInfo":[
          {
            "contactId":"1",
            "role":"custodian"
          }
        ]
      }
    ],
    "graphicOverview":[
      {
        "fileName":"allRecs_callCounts_bowhead_2010.jpg",
        "fileDescription":"This image is a spectraplot visualizing the density of Bowhead whale calls in the Northeast Chukchi Sea, AMAR recorder locations, and industry lease areas.",
        "fileType":"JPEG",
        "fileLink":"http://aoos.org/aoos-data-resources/bowhead_images2010_0114.jpg"
      },
      {
        "fileName":"cross_section_perc_sommer_2010.png",
        "fileDescription":"."
      },
      {
        "fileName":"pln40_perc_2010_01.png",
        "fileType":"PNG"
      },
      {
        "fileName":"pln40_spec_summer_2010.png"
      }
    ],
    "constraint":{
      "useLimitations":[
        "not for suitable for navigation",
        "draft version",
        "not intended for general use",
        "don't be a jerk"
      ],
      "legalConstraint":[
        {
          "accessConstraint":[
            "patentPending",
            "restricted"
          ],
          "useConstraint":[
            "restricted"
          ],
          "otherConstraint":[
            "Legally barred from use for navigation."
          ]
        },
        {
          "accessConstraint":[
            "otherRestrictions"
          ],
          "useConstraint":[
            "otherRestrictions"
          ],
          "otherConstraint":[
            "Access Constraint: No one else. Use Constraint: None"
          ]
        },
        {
          "accessConstraint":[
            "copyright",
            "patent",
            "patentPending",
            "trademark",
            "license",
            "intellectualPropertyRights",
            "restricted",
            "otherRestrictions"
          ]
        }
      ],
      "securityConstraint":[
        {
          "classification":"unclassified",
          "userNote":"security clearance not required",
          "classificationSystem":"none",
          "handlingDescription":"this is how to handle things..."
        },
        {
          "classification":"intellectualPropertyRights"
        },
        {
          "classification":"secret",
          "userNote":"shhhhh"
        }
      ]
    },
    "taxonomy":{
      "classificationSystem":[
        {
          "title":"Otter Record Survey",
          "date":[
            {
              "date":"2000",
              "dateType":"publication"
            }
          ],
          "responsibleParty":[
            {
              "contactId":"2",
              "role":"publisher"
            }
          ]
        }
      ],
      "taxonGeneralScope":"The otters observed were identified to the subspecies criterion and identified as southern sea otters.",
      "observer":[
        {
          "contactId":"1",
          "role":"principalInvestigator"
        },
        {
          "contactId":"2",
          "role":"pointOfContact"
        }
      ],
      "taxonomicProcedure":"volunteers observed sea otters using binoculars in pairs",
      "voucher":{
        "specimen":"weathered skull found on beach",
        "repository":{
          "contactId":"2",
          "role":"publisher"
        }
      },
      "taxonClass":[
        {
          "taxonRank":"Kingdom",
          "taxonValue":"Animalia"
        },
        {
          "taxonRank":"Phylum",
          "taxonValue":"Chordata"
        },
        {
          "taxonRank":"Subphylum",
          "taxonValue":"Vertebrata"
        },
        {
          "taxonRank":"Class",
          "taxonValue":"Mammalia"
        },
        {
          "taxonRank":"Subclass",
          "taxonValue":"Theria"
        },
        {
          "taxonRank":"Infraclass",
          "taxonValue":"Eutheria"
        },
        {